{
  "schema_version": 1,
  "attempt_id": "11111111-1111-4111-8111-111111111111",
  "lane": "F1",
  "sha": "aaaaaaaaaaaaaaaaaaaaaaaaaaaaaaaaaaaaaaaa",
  "inputs_sha256": "bbbbbbbbbbbbbbbbbbbbbbbbbbbbbbbbbbbbbbbbbbbbbbbbbbbbbbbbbbbbbbbb",
  "creation_boot_id": "22222222-2222-4222-8222-222222222222",
  "recovery_boot_id": null,
  "state": "prepared",
  "stage": "review",
  "controller_lease_path": "/tmp/clinic/attempt/review-lane-controllers/F1.lease",
  "controller_lease_identity": {"device": 1, "inode": 210, "mode": 384, "uid": 1000, "gid": 1000, "link_count": 1},
  "controller_lease_state": "held",
  "controller_owners": [{"sequence": 1, "boot_id": "22222222-2222-4222-8222-222222222222", "pid": 2100, "start_ticks": 6100, "acquired_at_utc": "2026-07-16T12:00:00.000000Z", "relinquished_at_utc": null, "relinquish_kind": null}],
  "completed_stages": [],
  "review_workspace_claim_id": "33333333-3333-4333-8333-333333333333",
  "private_environment_claim_id": null,
  "filesystem_state": "unreserved",
  "codex_tool_sha256": null,
  "uv_tool_sha256": null,
  "private_tree_sha256": null,
  "child_process_claim_id": null,
  "child_argv_sha256": null,
  "started_at_utc": null,
  "child_pid": null,
  "child_pgid": null,
  "child_start_ticks": null,
  "child_barrier_released": null,
  "termination_kind": null,
  "boot_disappearance_sha256": null,
  "wait_exit_code": null,
  "wait_signal": null,
  "timed_out": false,
  "typed_outcome_sha256": null,
  "child_cleanup_verified": false,
  "filesystem_cleanup_verified": false,
  "terminal_outputs_sha256": null,
  "updated_at_utc": "2026-07-16T12:00:00.000000Z"
}
